{
  "name": "meteorology",
  "version": "0.1.0",
  "description": "Forecast sources, clouds, sea-breeze, fog, synoptic charts",
  "author": {"name": "ZenterFlow", "url": "https://github.com/ZenterFlow"},
  "homepage": "https://github.com/ZenterFlow/sailing-claude-plugins",
  "repository": "https://github.com/ZenterFlow/sailing-claude-plugins.git",
  "license": "MIT",
  "keywords": ["sailing", "weather", "meteorology", "forecasting"],
  "agents": "./agents/meteorology-tutor.md"
}
