{
  "name": "passage-making",
  "version": "0.1.0",
  "description": "Planning, regulations, watch systems, monitoring, worked plans",
  "author": {"name": "ZenterFlow", "url": "https://github.com/ZenterFlow"},
  "homepage": "https://github.com/ZenterFlow/sailing-claude-plugins",
  "repository": "https://github.com/ZenterFlow/sailing-claude-plugins.git",
  "license": "MIT",
  "keywords": ["sailing", "navigation", "passage-planning", "offshore"],
  "agents": "./agents/passage-making-tutor.md",
  "skills": "./skills"
}
