{
  "name": "irpcs",
  "version": "0.1.0",
  "description": "General rules, sounds, day-shapes, lights, collision scenarios",
  "author": {"name": "ZenterFlow", "url": "https://github.com/ZenterFlow"},
  "homepage": "https://github.com/ZenterFlow/sailing-claude-plugins",
  "repository": "https://github.com/ZenterFlow/sailing-claude-plugins.git",
  "license": "MIT",
  "keywords": ["sailing", "colregs", "irpcs", "collision-regulations"],
  "agents": "./agents/irpcs-tutor.md"
}
