{
  "name": "collision-regs",
  "version": "0.1.0",
  "description": "Conduct in sight / restricted visibility, lights, sounds, exceptions",
  "author": {"name": "ZenterFlow", "url": "https://github.com/ZenterFlow"},
  "homepage": "https://github.com/ZenterFlow/sailing-claude-plugins",
  "repository": "https://github.com/ZenterFlow/sailing-claude-plugins.git",
  "license": "MIT",
  "keywords": ["sailing", "colregs", "collision-avoidance", "visibility"],
  "agents": "./agents/collision-regs-tutor.md"
}
