{
  "name": "ec-plotting",
  "version": "0.1.0",
  "description": "Chart-plotter operation, self-test questions",
  "author": {"name": "ZenterFlow", "url": "https://github.com/ZenterFlow"},
  "homepage": "https://github.com/ZenterFlow/sailing-claude-plugins",
  "repository": "https://github.com/ZenterFlow/sailing-claude-plugins.git",
  "license": "MIT",
  "keywords": ["sailing", "navigation", "chartplotter", "electronic-charts"],
  "agents": "./agents/ec-plotting-tutor.md"
}
