{
  "name": "tides",
  "version": "0.1.0",
  "description": "Complete tidal calculations: heights, times, streams, diamonds, safety checks",
  "author": {
    "name": "ZenterFlow",
    "url": "https://github.com/ZenterFlow"
  },
  "homepage": "https://github.com/ZenterFlow/sailing-claude-plugins",
  "repository": "https://github.com/ZenterFlow/sailing-claude-plugins.git",
  "license": "MIT",
  "keywords": ["sailing", "navigation", "tides", "tidal-streams", "safety", "rya", "asa"],
  "agents": "./agents/tides-tutor.md",
  "skills": "./skills"
}
