{
  "name": "pilotage",
  "version": "0.1.0",
  "description": "Leading lines, clearing bearings, restricted visibility plans",
  "author": {"name": "ZenterFlow", "url": "https://github.com/ZenterFlow"},
  "homepage": "https://github.com/ZenterFlow/sailing-claude-plugins",
  "repository": "https://github.com/ZenterFlow/sailing-claude-plugins.git",
  "license": "MIT",
  "keywords": ["sailing", "navigation", "pilotage", "harbor-entry"],
  "agents": "./agents/pilotage-tutor.md",
  "skills": "./skills"
}
